{
  "event_id": "evt-7f3a1c9e-21d4-4b2a-9c0a-1a2b3c4d5e6f",
  "timestamp": "2026-10-22T13:45:02.123Z",
  "servicio": "pedidos-api",
  "endpoint": "/api/v1/pedidos/{id}",
  "metodo_http": "GET",
  "codigo_http": 200,
  "latencia_ms": 184.7,
  "region": "us-central1",
  "instancia": "pedidos-api-7d8f9c-xk2qp"
}
